<?xml version="1.0" encoding="ISO-8859-9"?>
<page xmlns:xsi="http://www.w3.org/2001/XMLSchema-instance"  xsi:noNamespaceSchemaLocation="xsd/index.xsd">
    <section>
        <header>Merhaba DÃ¼nya</header>
    </section>
    <section>
        <dropdown size="1">
            <media small="2"/>
            <items>
                <item label="Select Country" data="" />
                <item label="Turkey" data="turkey" />
                <item label="France" data="france" />
                <item label="Germany" data="germany" />
                <item label="Italy" data="italy" />
                <item label="Spain" data="spain" />
                <item label="England" data="englang" />
                <item label="Brazil" data="brazil" />
                <item label="Switzerland" data="switzerlang" />
                <item label="Georgia" data="georgia" />
                <item label="Moldovia" data="moldovia" />
            </items>
        </dropdown>
    </section>
</page>